[
  {
    "id": "A1",
    "stage": "A",
    "stageName": "Search",
    "recipientRole": "estate-agent",
    "title": "Estate agent — viewing request",
    "description": "Arrange a viewing with proceedability signals in one short email.",
    "subjectTemplate": "Viewing — {{listing.address}}",
    "bodyTemplate": "Hi {{contact.agentName}},\n\nI'd like to arrange a viewing of {{listing.address}} (listed at £{{listing.askingPrice}}, {{listing.portal}} ref {{listing.ref}}).\n\nPosition: first-time buyer, chain-free, AIP in place for £{{finances.aipAmount}}.\n\nCould either {{viewingDateOption1}} or {{viewingDateOption2}} work? I can also do most evenings after 5pm.\n\nMany thanks,\n{{profile.firstName}} {{profile.lastName}}\n{{profile.mobile}}",
    "dataNeeded": [
      "profile.firstName",
      "profile.lastName",
      "profile.mobile",
      "contact.agentName",
      "listing.address",
      "listing.askingPrice",
      "listing.portal",
      "listing.ref",
      "finances.aipAmount",
      "viewingDateOption1",
      "viewingDateOption2"
    ],
    "tone": "warm-brief",
    "attachmentsHint": [],
    "bestPracticeNotes": [
      "Mentions proceedability in one line — earns priority in the agent's pile",
      "Offers two specific time slots — research shows this triples the reply rate vs. 'when suits'",
      "Includes the listing reference so the agent can find the property instantly"
    ],
    "sources": [
      { "title": "Avocado Property — Setting up a viewing", "url": "https://avocadopropertyagents.co.uk/blog/setting-up-a-viewing/734" },
      { "title": "Rightmove Guides — sent enquiries", "url": "https://www.rightmove.co.uk/guides/keep-track-of-your-sent-enquiries-to-estate-agents/" }
    ]
  },
  {
    "id": "A2",
    "stage": "A",
    "stageName": "Search",
    "recipientRole": "estate-agent",
    "title": "Estate agent — saved-search registration",
    "description": "Introduce yourself so the agent calls you first when a matching property comes to market.",
    "subjectTemplate": "FTB buyer registration — {{criteria.areaFocus}}",
    "bodyTemplate": "Hi {{contact.agentName}},\n\nI wanted to introduce myself — I'm actively looking for a property in {{criteria.areaFocus}} and would like to register with you so you can alert me when something suitable comes on.\n\nWhat I'm looking for:\n- {{criteria.beds}}-bed freehold, ideally {{criteria.propertyType}}\n- Budget up to £{{criteria.budget}}\n- Must-haves: {{criteria.mustHaves}}\n- Target move: {{finances.goal.movingWindow}}\n\nMy position: first-time buyer, chain-free, AIP in place for £{{finances.aipAmount}}. I'm proceedable now.\n\nPlease do keep me on your list — I reply promptly and I'm serious about moving. My mobile is {{profile.mobile}}.\n\nThanks,\n{{profile.firstName}} {{profile.lastName}}\n{{profile.mobile}} · {{profile.email}}",
    "dataNeeded": [
      "profile.firstName",
      "profile.lastName",
      "profile.mobile",
      "profile.email",
      "contact.agentName",
      "criteria.areaFocus",
      "criteria.beds",
      "criteria.propertyType",
      "criteria.budget",
      "criteria.mustHaves",
      "finances.aipAmount",
      "finances.goal.movingWindow"
    ],
    "tone": "warm-brief",
    "attachmentsHint": [],
    "bestPracticeNotes": [
      "Agents prioritise registered buyers with AIP — you move to the top of their call list",
      "Listing specific criteria saves agents filtering unsuitable properties at you",
      "Saying 'I reply promptly' signals you are a low-friction buyer — agents prefer easy completions"
    ],
    "sources": [
      { "title": "HomeOwners Alliance — Finding a property", "url": "https://hoa.org.uk/advice/guides-for-homeowners/i-am-buying/top-tips-clever-questions-to-ask-the-estate-agent/" },
      { "title": "MoneySavingExpert — Estate agents by email", "url": "https://forums.moneysavingexpert.com/discussion/6502007/do-you-deal-with-estate-agents-by-email" }
    ]
  },
  {
    "id": "A3",
    "stage": "A",
    "stageName": "Search",
    "recipientRole": "estate-agent",
    "title": "Estate agent — pre-viewing question batch",
    "description": "Get answers to the 10 key questions before spending time on a viewing.",
    "subjectTemplate": "Questions — {{listing.address}}",
    "bodyTemplate": "Hi {{contact.agentName}},\n\nBefore I book a viewing of {{listing.address}}, could you confirm a few things?\n\n1. Chain: is the vendor already in a chain, or are they chain-free?\n2. Time on market: how long has the property been listed?\n3. Offers: have any offers already been made or declined?\n4. EPC: what is the current energy rating?\n5. Council tax: which band?\n6. Any structural disclosures — damp, subsidence, planning refusals, boundary disputes?\n7. Parking: is there off-street parking included?\n8. Broadband: what is the current speed/type available?\n9. Last sold: when and for how much?\n10. Reason for sale?\n\nMany thanks — happy to book a viewing once I have these.\n\n{{profile.firstName}} {{profile.lastName}}\n{{profile.mobile}}",
    "dataNeeded": [
      "profile.firstName",
      "profile.lastName",
      "profile.mobile",
      "contact.agentName",
      "listing.address"
    ],
    "tone": "warm-brief",
    "attachmentsHint": [],
    "bestPracticeNotes": [
      "Gathering this before viewing saves a wasted trip and signals you're a serious, prepared buyer",
      "Structural disclosures — asked in writing — are harder for agents to dismiss later",
      "Reason for sale and time on market inform your offer strategy before you set foot inside"
    ],
    "sources": [
      { "title": "HomeOwners Alliance — 25 questions to ask the estate agent", "url": "https://hoa.org.uk/advice/guides-for-homeowners/i-am-buying/top-tips-clever-questions-to-ask-the-estate-agent/" },
      { "title": "Propphy — Follow-up email templates", "url": "https://www.propphy.com/blog/real-estate-follow-up-email-templates" }
    ]
  },
  {
    "id": "A4",
    "stage": "A",
    "stageName": "Search",
    "recipientRole": "vendor",
    "title": "Vendor direct — off-market enquiry",
    "description": "A polite, human letter to a homeowner you'd love to buy from.",
    "subjectTemplate": "A short note about {{vendor.streetName}}",
    "bodyTemplate": "Hello,\n\nI hope you don't mind a short letter from a stranger. My name is {{profile.firstName}} — I've been looking for a home in {{vendor.areaName}} for several months and I love your street.\n\nI'm a first-time buyer, chain-free, with a mortgage agreement already in place. I'm not from an agency and there's no fee involved — I'd simply love to know if you've ever thought about selling, now or in the next year. If the timing is wrong, I completely understand — please feel free to disregard this.\n\nIf it's a 'maybe one day', I'd really value a brief chat. You can reach me on {{profile.mobile}} or {{profile.email}} — no obligation, no follow-up unless you'd like one.\n\nWith thanks,\n{{profile.firstName}}",
    "dataNeeded": [
      "profile.firstName",
      "profile.mobile",
      "profile.email",
      "vendor.streetName",
      "vendor.areaName"
    ],
    "tone": "warm-human-no-jargon",
    "attachmentsHint": [],
    "bestPracticeNotes": [
      "First-name only — you're writing to someone's home, not a transaction",
      "Opt-out language up front earns the right to be read",
      "No price, no specifics — that conversation comes if they reply",
      "Avoids spam-trigger phrases ('cash buyer', 'will pay any price') that read as wholesaler outreach"
    ],
    "sources": [
      { "title": "Agent Fire — Cold email guide for real estate leads", "url": "https://agentfire.com/blog/the-catch-all-guide-for-cold-emailing-real-estate-leads/" }
    ]
  },
  {
    "id": "A5",
    "stage": "A",
    "stageName": "Search",
    "recipientRole": "mortgage-broker",
    "title": "Mortgage broker — initial enquiry",
    "description": "Full intro to a broker with all the numbers they need to advise you.",
    "subjectTemplate": "FTB mortgage enquiry — Hampshire/Wiltshire",
    "bodyTemplate": "Hi {{contact.brokerName}},\n\nI'm looking for first-time buyer mortgage advice and would like to set up an initial call.\n\nQuick context so you can come prepared:\n- Solo applicant, no dependents, excellent credit, no adverse history.\n- Permanent employment: £{{finances.income.annualBaseSalary}} base + ~£{{finances.income.annualBonus}} average bonus.\n- Target property price: £{{finances.goal.targetPropertyPrice}} (offer target £{{finances.goal.offerTarget}}).\n- Deposit: £{{finances.goal.targetDeposit}} ({{finances.goal.depositPct}}% LTV target).\n- Saving £{{finances.savings.monthlyContribution}}/month; currently £{{finances.savings.current}} saved.\n- Moving window: {{finances.goal.movingWindow}}.\n- Preference: {{finances.mortgage.fixedRatePref}} fixed, willing to pay £{{finances.mortgage.feesWillingness.max}} max in arrangement fees.\n- Search area: Hampshire (near Winchester/Salisbury), countryside villages.\n\nCould we book a 30-minute call this week or next? Tuesday/Thursday afternoons work well for me, but I'm flexible.\n\nThanks,\n{{profile.firstName}} {{profile.lastName}}\n{{profile.mobile}} · {{profile.email}}",
    "dataNeeded": [
      "profile.firstName",
      "profile.lastName",
      "profile.mobile",
      "profile.email",
      "contact.brokerName",
      "finances.income.annualBaseSalary",
      "finances.income.annualBonus",
      "finances.goal.targetPropertyPrice",
      "finances.goal.offerTarget",
      "finances.goal.targetDeposit",
      "finances.goal.depositPct",
      "finances.goal.movingWindow",
      "finances.savings.monthlyContribution",
      "finances.savings.current",
      "finances.mortgage.fixedRatePref",
      "finances.mortgage.feesWillingness.max"
    ],
    "tone": "warm-complete",
    "attachmentsHint": [],
    "bestPracticeNotes": [
      "Brokers triage by completeness — listing all the numbers up front saves a back-and-forth",